"","ï..Organization","Type","Loation","Website","Twitter","Facebook","People","Likely.Inactive","Last.Mode","OrgCity","lon","lat","type","loctype","address","north","south","east","west"
"148","World Resources Institute (WRI) ","Policy, Consulting","Mumbai","http://wri-india.org","https://twitter.com/wriindia","https://www.facebook.com/wriindia/","Ajay Nagpure, Bhavay Sharma","","9/1/2020 3:27pm","World Resources Institute (WRI)  , Mumbai",-77.0081511,38.8991228,"establishment","rooftop","10 g st ne #800, washington, dc 20002, usa",38.9004717802915,38.8977738197085,-77.0068021197085,-77.0095000802915
"149","WWF India","","Delhi","","","","","","9/1/2020 3:28pm","WWF India , Delhi",77.223072,28.590965,"establishment","rooftop","pirojsha godrej building, 172 b, lodhi rd, lodhi gardens, lodhi estate, new delhi, delhi 110003, india",28.5923139802915,28.5896160197085,77.2244209802915,77.2217230197085
"150","Youth Clean Air Network","Advocacy, Public Engagement & Awareness, Non Profit","","http://www.youthforcleanair.com/Default.aspx","","","","","8/17/2019 2:36am","Youth Clean Air Network , ",NA,NA,NA,NA,NA,NA,NA,NA,NA
"151","Yuktix","Industry, Start-up","","http://www.yuktix.com/","https://twitter.com/yuktix","https://www.facebook.com/yuktix","","","8/28/2019 2:04am","Yuktix , ",77.6445115,12.9048526,"establishment","geometric_center","no.1713, 2nd floor, crossing of 19th main rd, 27th cross rd, above kr bakery, garden layout, sector 2, hsr layout, bengaluru, karnataka 560102, india",12.9062015802915,12.9035036197085,77.6458604802915,77.6431625197085
"152","Sree Krishna College Guruvayur","Government","Guruvayur","https://www.sreekrishnacollege.in/","","","","","9/1/2020 10:20pm","Sree Krishna College Guruvayur , Guruvayur",76.0883769,10.6073898,"establishment","geometric_center","choondal mattom rd, koonammoochi, alur, kerala 680602, india",10.6087387802915,10.6060408197085,76.0897258802915,76.0870279197085
"153","Conexsym Global Pvt. Ltd.","Research, Consulting, Global, Public Engagement & Awareness","Noida","www.conexsym.com","https://twitter.com/conexsym","https://www.facebook.com/profile.php?id=100041043078960","","","9/1/2020 11:22pm","Conexsym Global Pvt. Ltd. , Noida",NA,NA,NA,NA,NA,NA,NA,NA,NA
"154","Vijay Panjwani","Advocacy","New Delhi","","","Vijay Panjwani","","","9/2/2020 1:15pm","Vijay Panjwani , New Delhi",77.2090212,28.6139391,"locality","approximate","new delhi, delhi, india",28.6506044,28.4041,77.3449601,77.0730101
"155","Hindu College, University of Delhi","Government","Delhi","www.hinducollege.ac.in","","","","","9/3/2020 1:05am","Hindu College, University of Delhi , Delhi",77.2110226,28.6843252,"establishment","geometric_center","sudhir bose marg, hindu college, university enclave, delhi, 110007, india",28.6856741802915,28.6829762197085,77.2123715802915,77.2096736197085
"156","Department of Environmental Studies, Zakir Husain Delhi College, University of Delhi","Government","New Delhi","http://www.zakirhusaindelhicollege.ac.in/","https://twitter.com/ZakirHCollegeDU","https://www.facebook.com/zhdelhicollege","","","9/3/2020 1:12am","Department of Environmental Studies, Zakir Husain Delhi College, University of Delhi , New Delhi",77.2296529,28.6393325,"establishment","geometric_center","jawaharlal nehru marg, skd basti, press enclave, ajmeri gate, new delhi, delhi 110002, india",28.6406814802915,28.6379835197085,77.2310018802915,77.2283039197085
"157","Air Pollution Action Group","Non Profit, Advocacy, Public Engagement & Awareness, Start-up","New Delhi, India","www.a-pag.org","","","","","9/3/2020 8:20am","Air Pollution Action Group , New Delhi, India",77.2240626,28.6297998,"establishment","geometric_center","301-302 narain manzil, barakhamba rd, barakhamba, new delhi, delhi 110001, india",28.6311487802915,28.6284508197085,77.2254115802915,77.2227136197085
